Title,Summary,Updated,Category,Link
"Simple characterizations for commutativity of quantum weakest
  preconditions","  In a recent letter [Information Processing Letters~104 (2007) 152-158], it
has shown some sufficient conditions for commutativity of quantum weakest
preconditions. This paper provides some alternative and simple
characterizations for the commutativity of quantum weakest preconditions, i.e.,
Theorem 3.1, Theorem 3.2 and Proposition 3.3 in what follows. We also show that
to characterize the commutativity of quantum weakest preconditions in terms of
$[M,N]$ ($=MN-NM$) is hard in the sense of Proposition 4.1 and Proposition 4.2.
",2023-07-19,Computer Science - Logic in Computer Science,http://arxiv.org/abs/1108.4607
Emotional Analysis of Blogs and Forums Data,"  We perform a statistical analysis of emotionally annotated comments in two
large online datasets, examining chains of consecutive posts in the
discussions. Using comparisons with randomised data we show that there is a
high level of correlation for the emotional content of messages.
",2023-07-19,Computer Science - Computation and Language,http://arxiv.org/abs/1108.5974
"Kripke Semantics for Martin-L\""of's Extensional Type Theory","  It is well-known that simple type theory is complete with respect to
non-standard set-valued models. Completeness for standard models only holds
with respect to certain extended classes of models, e.g., the class of
cartesian closed categories. Similarly, dependent type theory is complete for
locally cartesian closed categories. However, it is usually difficult to
establish the coherence of interpretations of dependent type theory, i.e., to
show that the interpretations of equal expressions are indeed equal. Several
classes of models have been used to remedy this problem. We contribute to this
investigation by giving a semantics that is standard, coherent, and
sufficiently general for completeness while remaining relatively easy to
compute with. Our models interpret types of Martin-L\""of's extensional
dependent type theory as sets indexed over posets or, equivalently, as
fibrations over posets. This semantics can be seen as a generalization to
dependent type theory of the interpretation of intuitionistic first-order logic
in Kripke models. This yields a simple coherent model theory, with respect to
which simple and dependent type theory are sound and complete.
",2023-03-31,Computer Science - Logic in Computer Science,http://arxiv.org/abs/1109.1702
"Circadian patterns of Wikipedia editorial activity: A demographic
  analysis","  Wikipedia (WP) as a collaborative, dynamical system of humans is an
appropriate subject of social studies. Each single action of the members of
this society, i.e. editors, is well recorded and accessible. Using the
cumulative data of 34 Wikipedias in different languages, we try to characterize
and find the universalities and differences in temporal activity patterns of
editors. Based on this data, we estimate the geographical distribution of
editors for each WP in the globe. Furthermore we also clarify the differences
among different groups of WPs, which originate in the variance of cultural and
social features of the communities of editors.
",2023-01-05,Physics - Physics and Society,http://arxiv.org/abs/1109.1746
Relative Error Control in Bivariate Interpolatory Cubature,"  We describe an algorithm for controlling the relative error in the numerical
evaluation of a bivariate integral, without prior knowledge of the magnitude of
the integral. In the event that the magnitude of the integral is less than
unity, absolute error control is preferred. The underlying quadrature rule is
positive-weight interpolatory and composite. Some numerical examples
demonstrate the algorithm.
",2023-12-12,Mathematics - Numerical Analysis,http://arxiv.org/abs/1110.2324
Nystrom Methods in the RKQ Algorithm for Initial-value Problems,"  We incorporate explicit Nystrom methods into the RKQ algorithm for stepwise
global error control in numerical solutions of initial-value problems. The
initial-value problem is transformed into an explicitly second-order problem,
so as to be suitable for Nystrom integration. The Nystrom methods used are
fourth-order, fifth-order and 10th-order. Two examples demonstrate the
effectiveness of the algorithm.
",2023-11-28,Mathematics - Numerical Analysis,http://arxiv.org/abs/1110.6749
Data Processing For Atomic Resolution EELS,"  The high beam current and sub-angstrom resolution of aberration-corrected
scanning transmission electron microscopes has enabled electron energy loss
spectroscopic (EELS) mapping with atomic resolution. These spectral maps are
often dose-limited and spatially oversampled, leading to low counts/channel and
are thus highly sensitive to errors in background estimation. However, by
taking advantage of redundancy in the dataset map one can improve background
estimation and increase chemical sensitivity. We consider two such approaches-
linear combination of power laws and local background averaging-that reduce
background error and improve signal extraction. Principal components analysis
(PCA) can also be used to analyze spectrum images, but the poor
peak-to-background ratio in EELS can lead to serious artifacts if raw EELS data
is PCA filtered. We identify common artifacts and discuss alternative
approaches. These algorithms are implemented within the Cornell Spectrum
Imager, an open source software package for spectroscopic analysis.
",2023-07-19,Condensed Matter - Materials Science,http://arxiv.org/abs/1112.3059
A Novel Chaotic Image Encryption using Generalized Threshold Function,"  In this paper, after reviewing the main points of image encryption and
threshold function, we introduce the methods of chaotic image encryption based
on pseudorandom bit padding that the bits be generated by the novel generalized
threshold function (segmentation and self-similarity) methods. These methods
decrease periodic effect of the ergodic dynamical systems in randomness of the
chaotic image encryption. The essential idea of this paper is that given
threshold functions of the ergodic dynamical systems. To evaluate the security
of the cipher image of this scheme, the key space analysis, the correlation of
two adjacent pixels and differential attack were performed. This scheme tries
to improve the problem of failure of encryption such as small key space and
level of security.
",2023-07-19,Computer Science - Cryptography and Security,http://arxiv.org/abs/1112.3791
Inductive types in homotopy type theory,"  Homotopy type theory is an interpretation of Martin-L\""of's constructive type
theory into abstract homotopy theory. There results a link between constructive
mathematics and algebraic topology, providing topological semantics for
intensional systems of type theory as well as a computational approach to
algebraic topology via type theory-based proof assistants such as Coq.
  The present work investigates inductive types in this setting. Modified rules
for inductive types, including types of well-founded trees, or W-types, are
presented, and the basic homotopical semantics of such types are determined.
Proofs of all results have been formally verified by the Coq proof assistant,
and the proof scripts for this verification form an essential component of this
research.
",2023-03-31,Mathematics - Logic,http://arxiv.org/abs/1201.3898
"Orthogonal Multiple Access with Correlated Sources: Feasible Region and
  Pragmatic Schemes","  In this paper, we consider orthogonal multiple access coding schemes, where
correlated sources are encoded in a distributed fashion and transmitted,
through additive white Gaussian noise (AWGN) channels, to an access point (AP).
At the AP, component decoders, associated with the source encoders, iteratively
exchange soft information by taking into account the source correlation. The
first goal of this paper is to investigate the ultimate achievable performance
limits in terms of a multi-dimensional feasible region in the space of channel
parameters, deriving insights on the impact of the number of sources. The
second goal is the design of pragmatic schemes, where the sources use
""off-the-shelf"" channel codes. In order to analyze the performance of given
coding schemes, we propose an extrinsic information transfer (EXIT)-based
approach, which allows to determine the corresponding multi-dimensional
feasible regions. On the basis of the proposed analytical framework, the
performance of pragmatic coded schemes, based on serially concatenated
convolutional codes (SCCCs), is discussed.
",2023-02-08,Computer Science - Information Theory,http://arxiv.org/abs/1201.6548
"rFerns: An Implementation of the Random Ferns Method for General-Purpose
  Machine Learning","  In this paper I present an extended implementation of the Random ferns
algorithm contained in the R package rFerns. It differs from the original by
the ability of consuming categorical and numerical attributes instead of only
binary ones. Also, instead of using simple attribute subspace ensemble it
employs bagging and thus produce error approximation and variable importance
measure modelled after Random forest algorithm. I also present benchmarks'
results which show that although Random ferns' accuracy is mostly smaller than
achieved by Random forest, its speed and good quality of importance measure it
provides make rFerns a reasonable choice for a specific applications.
",2023-08-15,Computer Science - Machine Learning,http://arxiv.org/abs/1202.1121
Variants of local algorithms on sparse graphs,"  Suppose we want to construct some structure on a bounded-degree graph, e.g.,
an almost maximum matching, and we want to decide about each edge depending
only on its constant-radius neighborhood. We examine and compare the strengths
of different extensions of these local algorithms. A common extension is to use
preprocessing, which means that we can make some calculation about the whole
graph, and each local decision can also depend on this calculation. In this
paper, we show that preprocessing is needless: if a nearly optimal local
algorithm uses preprocessing, then the same can be achieved by a local
algorithm without preprocessing, but with a global randomization.
",2023-11-03,Mathematics - Combinatorics,http://arxiv.org/abs/1202.1565
Dynamics of conflicts in Wikipedia,"  In this work we study the dynamical features of editorial wars in Wikipedia
(WP). Based on our previously established algorithm, we build up samples of
controversial and peaceful articles and analyze the temporal characteristics of
the activity in these samples. On short time scales, we show that there is a
clear correspondence between conflict and burstiness of activity patterns, and
that memory effects play an important role in controversies. On long time
scales, we identify three distinct developmental patterns for the overall
behavior of the articles. We are able to distinguish cases eventually leading
to consensus from those cases where a compromise is far from achievable.
Finally, we analyze discussion networks and conclude that edit wars are mainly
fought by few editors only.
",2023-01-05,Physics - Physics and Society,http://arxiv.org/abs/1202.3643
"On equivalence, languages equivalence and minimization of multi-letter
  and multi-letter measure-many quantum automata","  We first show that given a $k_1$-letter quantum finite automata
$\mathcal{A}_1$ and a $k_2$-letter quantum finite automata $\mathcal{A}_2$ over
the same input alphabet $\Sigma$, they are equivalent if and only if they are
$(n_1^2+n_2^2-1)|\Sigma|^{k-1}+k$-equivalent where $n_1$, $i=1,2$, are the
numbers of state in $\mathcal{A}_i$ respectively, and $k=\max\{k_1,k_2\}$. By
applying a method, due to the author, used to deal with the equivalence problem
of {\it measure many one-way quantum finite automata}, we also show that a
$k_1$-letter measure many quantum finite automaton $\mathcal{A}_1$ and a
$k_2$-letter measure many quantum finite automaton $\mathcal{A}_2$ are
equivalent if and only if they are $(n_1^2+n_2^2-1)|\Sigma|^{k-1}+k$-equivalent
where $n_i$, $i=1,2$, are the numbers of state in $\mathcal{A}_i$ respectively,
and $k=\max\{k_1,k_2\}$.
  Next, we study the language equivalence problem of those two kinds of quantum
finite automata. We show that for $k$-letter quantum finite automata, the
non-strict cut-point language equivalence problem is undecidable, i.e., it is
undecidable whether
$L_{\geq\lambda}(\mathcal{A}_1)=L_{\geq\lambda}(\mathcal{A}_2)$ where
$0<\lambda\leq 1$ and $\mathcal{A}_i$ are $k_i$-letter quantum finite automata.
Further, we show that both strict and non-strict cut-point language equivalence
problem for $k$-letter measure many quantum finite automata are undecidable.
The direct consequences of the above outcomes are summarized in the paper.
  Finally, we comment on existing proofs about the minimization problem of one
way quantum finite automata not only because we have been showing great
interest in this kind of problem, which is very important in classical automata
theory, but also due to that the problem itself, personally, is a challenge.
This problem actually remains open.
",2023-07-21,Computer Science - Computational Complexity,http://arxiv.org/abs/1203.0113
"Posterior Mean Super-Resolution with a Compound Gaussian Markov Random
  Field Prior","  This manuscript proposes a posterior mean (PM) super-resolution (SR) method
with a compound Gaussian Markov random field (MRF) prior. SR is a technique to
estimate a spatially high-resolution image from observed multiple
low-resolution images. A compound Gaussian MRF model provides a preferable
prior for natural images that preserves edges. PM is the optimal estimator for
the objective function of peak signal-to-noise ratio (PSNR). This estimator is
numerically determined by using variational Bayes (VB). We then solve the
conjugate prior problem on VB and the exponential-order calculation cost
problem of a compound Gaussian MRF prior with simple Taylor approximations. In
experiments, the proposed method roughly overcomes existing methods.
",2023-06-01,Computer Science - Computer Vision and Pattern Recognition,http://arxiv.org/abs/1203.0781
A practical approach to language complexity: a Wikipedia case study,"  In this paper we present statistical analysis of English texts from
Wikipedia. We try to address the issue of language complexity empirically by
comparing the simple English Wikipedia (Simple) to comparable samples of the
main English Wikipedia (Main). Simple is supposed to use a more simplified
language with a limited vocabulary, and editors are explicitly requested to
follow this guideline, yet in practice the vocabulary richness of both samples
are at the same level. Detailed analysis of longer units (n-grams of words and
part of speech tags) shows that the language of Simple is less complex than
that of Main primarily due to the use of shorter sentences, as opposed to
drastically simplified syntax or vocabulary. Comparing the two language
varieties by the Gunning readability index supports this conclusion. We also
report on the topical dependence of language complexity, e.g. that the language
is more advanced in conceptual articles compared to person-based (biographical)
and object-based articles. Finally, we investigate the relation between
conflict and language complexity by analyzing the content of the talk pages
associated to controversial and peacefully developing articles, concluding that
controversy has the effect of reducing language complexity.
",2023-01-05,Computer Science - Computation and Language,http://arxiv.org/abs/1204.2765
Quantitative Concept Analysis,"  Formal Concept Analysis (FCA) begins from a context, given as a binary
relation between some objects and some attributes, and derives a lattice of
concepts, where each concept is given as a set of objects and a set of
attributes, such that the first set consists of all objects that satisfy all
attributes in the second, and vice versa. Many applications, though, provide
contexts with quantitative information, telling not just whether an object
satisfies an attribute, but also quantifying this satisfaction. Contexts in
this form arise as rating matrices in recommender systems, as occurrence
matrices in text analysis, as pixel intensity matrices in digital image
processing, etc. Such applications have attracted a lot of attention, and
several numeric extensions of FCA have been proposed. We propose the framework
of proximity sets (proxets), which subsume partially ordered sets (posets) as
well as metric spaces. One feature of this approach is that it extracts from
quantified contexts quantified concepts, and thus allows full use of the
available information. Another feature is that the categorical approach allows
analyzing any universal properties that the classical FCA and the new versions
may have, and thus provides structural guidance for aligning and combining the
approaches.
",2023-11-03,Computer Science - Machine Learning,http://arxiv.org/abs/1204.5802
Combinatorial aspect of fashion,"  Simulations are performed according to the Axelrod model of culture
dissemination, with modified mechanism of repulsion. Previously, repulsion was
considered by Radillo-Diaz et al (Phys. Rev. E 80 (2009) 066107) as dependent
on a predefined threshold. Here the probabilities of attraction and repulsion
are calculated from the number of cells in the same states. We also investigate
the influence of some homogeneity, introduced to the initial state. As the
result of the probabilistic definition of repulsion, the ordered state
vanishes. A small cluster of a few percent of population is retained only if in
the initial state a set of agents is prepared in the same state. We conclude
that the modelled imitation is successful only with respect to agents, and not
only their features.
",2023-07-19,Physics - Physics and Society,http://arxiv.org/abs/1205.2251
"The Longest Queue Drop Policy for Shared-Memory Switches is
  1.5-competitive","  We consider the Longest Queue Drop memory management policy in shared-memory
switches consisting of $N$ output ports. The shared memory of size $M\geq N$
may have an arbitrary number of input ports. Each packet may be admitted by any
incoming port, but must be destined to a specific output port and each output
port may be used by only one queue. The Longest Queue Drop policy is a natural
online strategy used in directing the packet flow in buffering problems.
According to this policy and assuming unit packet values and cost of
transmission, every incoming packet is accepted, whereas if the shared memory
becomes full, one or more packets belonging to the longest queue are preempted,
in order to make space for the newly arrived packets. It was proved in 2001
[Hahne et al., SPAA '01] that the Longest Queue Drop policy is 2-competitive
and at least $\sqrt{2}$-competitive. It remained an open question whether a
(2-\epsilon) upper bound for the competitive ratio of this policy could be
shown, for any positive constant \epsilon. We show that the Longest Queue Drop
online policy is 1.5-competitive.
",2023-02-09,Computer Science - Data Structures and Algorithms,http://arxiv.org/abs/1207.1141
"Opinions, Conflicts and Consensus: Modeling Social Dynamics in a
  Collaborative Environment","  Information-communication technology promotes collaborative environments like
Wikipedia where, however, controversiality and conflicts can appear. To
describe the rise, persistence, and resolution of such conflicts we devise an
extended opinion dynamics model where agents with different opinions perform a
single task to make a consensual product. As a function of the convergence
parameter describing the influence of the product on the agents, the model
shows spontaneous symmetry breaking of the final consensus opinion represented
by the medium. In the case when agents are replaced with new ones at a certain
rate, a transition from mainly consensus to a perpetual conflict occurs, which
is in qualitative agreement with the scenarios observed in Wikipedia.
",2023-01-05,Physics - Physics and Society,http://arxiv.org/abs/1207.4914
A Session based Multiple Image Hiding Technique using DWT and DCT,"  This work proposes Steganographic technique for hiding multiple images in a
color image based on DWT and DCT. The cover image is decomposed into three
separate color planes namely R, G and B. Individual planes are decomposed into
subbands using DWT. DCT is applied in HH component of each plane. Secret images
are dispersed among the selected DCT coefficients using a pseudo random
sequence and a Session key. Secret images are extracted using the session key
and the size of the images from the planer decomposed stego image. In this
approach the stego image generated is of acceptable level of imperceptibility
and distortion compared to the cover image and the overall security is high.
",2023-07-19,Computer Science - Cryptography and Security,http://arxiv.org/abs/1208.0950
Value production in a collaborative environment,"  We review some recent endeavors and add some new results to characterize and
understand underlying mechanisms in Wikipedia (WP), the paradigmatic example of
collaborative value production. We analyzed the statistics of editorial
activity in different languages and observed typical circadian and weekly
patterns, which enabled us to estimate the geographical origins of
contributions to WPs in languages spoken in several time zones. Using a
recently introduced measure we showed that the editorial activities have
intrinsic dependencies in the burstiness of events. A comparison of the English
and Simple English WPs revealed important aspects of language complexity and
showed how peer cooperation solved the task of enhancing readability. One of
our focus issues was characterizing the conflicts or edit wars in WPs, which
helped us to automatically filter out controversial pages. When studying the
temporal evolution of the controversiality of such pages we identified typical
patterns and classified conflicts accordingly. Our quantitative analysis
provides the basis of modeling conflicts and their resolution in collaborative
environments and contribute to the understanding of this issue, which becomes
increasingly important with the development of information communication
technology.
",2023-01-05,Physics - Physics and Society,http://arxiv.org/abs/1208.5130
Proof of Church's Thesis,"  We prove that if our calculating capability is that of a universal Turing
machine with a finite tape, then Church's thesis is true. This way we
accomplish Post (1936) program.
",2023-03-22,Computer Science - Logic in Computer Science,http://arxiv.org/abs/1209.5036
"Network structure of phonographic market with characteristic
  similarities between musicians","  We investigate relations between best selling artists in last decade on
phonographic market and from perspective of listeners by using the Social
Network Analyzes. Starting network is obtained from the matrix of correlations
between the world's best selling artists by considering the synchronous time
evolution of weekly record sales. This method reveals the structure of
phonographic market, but we claim that it has no impact on people who see
relationship between artists and music genres. We compare 'sale' (based on
correlation of record sales) or 'popularity' (based on data mining of the
record charts) networks with 'similarity' (obtained mainly from survey within
music experts opinion) and find no significant relations. We postulate that
non-laminar phenomena on this specific market introduce turbulence to how
people view relations of artists.
",2023-07-19,Nonlinear Sciences - Adaptation and Self-Organizing Systems,http://arxiv.org/abs/1210.0225
Enumerating topological $(n_k)$-configurations,"  An $(n_k)$-configuration is a set of $n$ points and $n$ lines in the
projective plane such that their point-line incidence graph is $k$-regular. The
configuration is geometric, topological, or combinatorial depending on whether
lines are considered to be straight lines, pseudolines, or just combinatorial
lines. We provide an algorithm for generating, for given $n$ and $k$, all
topological $(n_k)$-configurations up to combinatorial isomorphism, without
enumerating first all combinatorial $(n_k)$-configurations. We apply this
algorithm to confirm efficiently a former result on topological
$(18_4)$-configurations, from which we obtain a new geometric
$(18_4)$-configuration. Preliminary results on $(19_4)$-configurations are also
briefly reported.
",2023-11-14,Computer Science - Computational Geometry,http://arxiv.org/abs/1210.0306
Feature Subset Selection for Software Cost Modelling and Estimation,"  Feature selection has been recently used in the area of software engineering
for improving the accuracy and robustness of software cost models. The idea
behind selecting the most informative subset of features from a pool of
available cost drivers stems from the hypothesis that reducing the
dimensionality of datasets will significantly minimise the complexity and time
required to reach to an estimation using a particular modelling technique. This
work investigates the appropriateness of attributes, obtained from empirical
project databases and aims to reduce the cost drivers used while preserving
performance. Finding suitable subset selections that may cater improved
predictions may be considered as a pre-processing step of a particular
technique employed for cost estimation (filter or wrapper) or an internal
(embedded) step to minimise the fitting error. This paper compares nine
relatively popular feature selection methods and uses the empirical values of
selected attributes recorded in the ISBSG and Desharnais datasets to estimate
software development effort.
",2023-12-21,Computer Science - Software Engineering,http://arxiv.org/abs/1210.1161
