Title,Summary,Updated,Category,Link
On the `Semantics' of Differential Privacy: A Bayesian Formulation,"  Differential privacy is a definition of ""privacy'"" for algorithms that
analyze and publish information about statistical databases. It is often
claimed that differential privacy provides guarantees against adversaries with
arbitrary side information. In this paper, we provide a precise formulation of
these guarantees in terms of the inferences drawn by a Bayesian adversary. We
show that this formulation is satisfied by both ""vanilla"" differential privacy
as well as a relaxation known as (epsilon,delta)-differential privacy. Our
formulation follows the ideas originally due to Dwork and McSherry [Dwork
2006]. This paper is, to our knowledge, the first place such a formulation
appears explicitly. The analysis of the relaxed definition is new to this
paper, and provides some concrete guidance for setting parameters when using
(epsilon,delta)-differential privacy.
",2023-01-24,Computer Science - Cryptography and Security,http://arxiv.org/abs/0803.3946
On the Dual Formulation of Boosting Algorithms,"  We study boosting algorithms from a new perspective. We show that the
Lagrange dual problems of AdaBoost, LogitBoost and soft-margin LPBoost with
generalized hinge loss are all entropy maximization problems. By looking at the
dual problems of these boosting algorithms, we show that the success of
boosting algorithms can be understood in terms of maintaining a better margin
distribution by maximizing margins and at the same time controlling the margin
variance.We also theoretically prove that, approximately, AdaBoost maximizes
the average margin, instead of the minimum margin. The duality formulation also
enables us to develop column generation based optimization algorithms, which
are totally corrective. We show that they exhibit almost identical
classification results to that of standard stage-wise additive boosting
algorithms but with much faster convergence rates. Therefore fewer weak
classifiers are needed to build the ensemble using our proposed optimization
technique.
",2023-05-30,Computer Science - Machine Learning,http://arxiv.org/abs/0901.3590
Domain Adaptation: Learning Bounds and Algorithms,"  This paper addresses the general problem of domain adaptation which arises in
a variety of applications where the distribution of the labeled sample
available somewhat differs from that of the test data. Building on previous
work by Ben-David et al. (2007), we introduce a novel distance between
distributions, discrepancy distance, that is tailored to adaptation problems
with arbitrary loss functions. We give Rademacher complexity bounds for
estimating the discrepancy distance from finite samples for different loss
functions. Using this distance, we derive novel generalization bounds for
domain adaptation for a wide family of loss functions. We also present a series
of novel adaptation bounds for large classes of regularization-based
algorithms, including support vector machines and kernel ridge regression based
on the empirical discrepancy. This motivates our analysis of the problem of
minimizing the empirical discrepancy for various loss functions for which we
also give novel algorithms. We report the results of preliminary experiments
that demonstrate the benefits of our discrepancy minimization algorithms for
domain adaptation.
",2023-12-04,Computer Science - Machine Learning,http://arxiv.org/abs/0902.3430
"Q-system Cluster Algebras, Paths and Total Positivity","  We review the solution of the $A_r$ Q-systems in terms of the partition
function of paths on a weighted graph, and show that it is possible to modify
the graphs and transfer matrices so as to provide an explicit connection to the
theory of planar networks introduced in the context of totally positive
matrices by Fomin and Zelevinsky.
",2023-07-12,Economics - General Economics,http://arxiv.org/abs/0906.3421
Optimization of Synthesis Oversampled Complex Filter Banks,"  An important issue with oversampled FIR analysis filter banks (FBs) is to
determine inverse synthesis FBs, when they exist. Given any complex oversampled
FIR analysis FB, we first provide an algorithm to determine whether there
exists an inverse FIR synthesis system. We also provide a method to ensure the
Hermitian symmetry property on the synthesis side, which is serviceable to
processing real-valued signals. As an invertible analysis scheme corresponds to
a redundant decomposition, there is no unique inverse FB. Given a particular
solution, we parameterize the whole family of inverses through a null space
projection. The resulting reduced parameter set simplifies design procedures,
since the perfect reconstruction constrained optimization problem is recast as
an unconstrained optimization problem. The design of optimized synthesis FBs
based on time or frequency localization criteria is then investigated, using a
simple yet efficient gradient algorithm.
",2023-01-19,Computer Science - Information Theory,http://arxiv.org/abs/0907.3654
"Message Passing for Integrating and Assessing Renewable Generation in a
  Redundant Power Grid","  A simplified model of a redundant power grid is used to study integration of
fluctuating renewable generation. The grid consists of large number of
generator and consumer nodes. The net power consumption is determined by the
difference between the gross consumption and the level of renewable generation.
The gross consumption is drawn from a narrow distribution representing the
predictability of aggregated loads, and we consider two different distributions
representing wind and solar resources. Each generator is connected to D
consumers, and redundancy is built in by connecting R of these consumers to
other generators. The lines are switchable so that at any instance each
consumer is connected to a single generator. We explore the capacity of the
renewable generation by determining the level of ""firm"" generation capacity
that can be displaced for different levels of redundancy R. We also develop
message-passing control algorithm for finding switch settings where no
generator is overloaded.
",2023-10-06,Physics - Physics and Society,http://arxiv.org/abs/0909.2358
"On the exact discretization of the classical harmonic oscillator
  equation","  We discuss the exact discretization of the classical harmonic oscillator
equation (including the inhomogeneous case and multidimensional
generalizations) with a special stress on the energy integral. We present and
suggest some numerical applications.
",2023-03-20,Mathematical Physics,http://arxiv.org/abs/0911.3672
Multi-camera Realtime 3D Tracking of Multiple Flying Animals,"  Automated tracking of animal movement allows analyses that would not
otherwise be possible by providing great quantities of data. The additional
capability of tracking in realtime - with minimal latency - opens up the
experimental possibility of manipulating sensory feedback, thus allowing
detailed explorations of the neural basis for control of behavior. Here we
describe a new system capable of tracking the position and body orientation of
animals such as flies and birds. The system operates with less than 40 msec
latency and can track multiple animals simultaneously. To achieve these
results, a multi target tracking algorithm was developed based on the Extended
Kalman Filter and the Nearest Neighbor Standard Filter data association
algorithm. In one implementation, an eleven camera system is capable of
tracking three flies simultaneously at 60 frames per second using a gigabit
network of nine standard Intel Pentium 4 and Core 2 Duo computers. This
manuscript presents the rationale and details of the algorithms employed and
shows three implementations of the system. An experiment was performed using
the tracking system to measure the effect of visual contrast on the flight
speed of Drosophila melanogaster. At low contrasts, speed is more variable and
faster on average than at high contrasts. Thus, the system is already a useful
tool to study the neurobiology and behavior of freely flying animals. If
combined with other techniques, such as `virtual reality'-type computer
graphics or genetic manipulation, the tracking system would offer a powerful
new way to investigate the biology of flying animals.
",2023-02-01,Computer Science - Computer Vision and Pattern Recognition,http://arxiv.org/abs/1001.4297
Explicit Evidence Systems with Common Knowledge,"  Justification logics are epistemic logics that explicitly include
justifications for the agents' knowledge. We develop a multi-agent
justification logic with evidence terms for individual agents as well as for
common knowledge. We define a Kripke-style semantics that is similar to
Fitting's semantics for the Logic of Proofs LP. We show the soundness,
completeness, and finite model property of our multi-agent justification logic
with respect to this Kripke-style semantics. We demonstrate that our logic is a
conservative extension of Yavorskaya's minimal bimodal explicit evidence logic,
which is a two-agent version of LP. We discuss the relationship of our logic to
the multi-agent modal logic S4 with common knowledge. Finally, we give a brief
analysis of the coordinated attack problem in the newly developed language of
our logic.
",2023-08-01,Computer Science - Logic in Computer Science,http://arxiv.org/abs/1005.0484
"Local algorithms for the maximum flow and minimum cut in bounded-degree
  networks","  We show a deterministic constant-time local algorithm for constructing an
approximately maximum flow and minimum fractional cut in
multisource-multitarget networks with bounded degrees and bounded edge
capacities. Locality means that the decision we make about each edge only
depends on its constant radius neighborhood. We show two applications of the
algorithms: one is related to the Aldous-Lyons Conjecture, and the other is
about approximating the neighborhood distribution of graphs by bounded-size
graphs. The scope of our results can be extended to unimodular random graphs
and networks. As a corollary, we generalize the Maximum Flow Minimum Cut
Theorem to unimodular random flow networks.
",2023-11-03,Computer Science - Data Structures and Algorithms,http://arxiv.org/abs/1005.0513
Nominal Unification from a Higher-Order Perspective,"  Nominal Logic is a version of first-order logic with equality, name-binding,
renaming via name-swapping and freshness of names. Contrarily to higher-order
logic, bindable names, called atoms, and instantiable variables are considered
as distinct entities. Moreover, atoms are capturable by instantiations,
breaking a fundamental principle of lambda-calculus. Despite these differences,
nominal unification can be seen from a higher-order perspective. From this
view, we show that nominal unification can be reduced to a particular fragment
of higher-order unification problems: Higher-Order Pattern Unification. This
reduction proves that nominal unification can be decided in quadratic
deterministic time, using the linear algorithm for Higher-Order Pattern
Unification. We also prove that the translation preserves most generality of
unifiers.
",2023-03-14,Computer Science - Logic in Computer Science,http://arxiv.org/abs/1005.3731
Inflection system of a language as a complex network,"  We investigate inflection structure of a synthetic language using Latin as an
example. We construct a bipartite graph in which one group of vertices
correspond to dictionary headwords and the other group to inflected forms
encountered in a given text. Each inflected form is connected to its
corresponding headword, which in some cases in non-unique. The resulting sparse
graph decomposes into a large number of connected components, to be called word
groups. We then show how the concept of the word group can be used to construct
coverage curves of selected Latin texts. We also investigate a version of the
inflection graph in which all theoretically possible inflected forms are
included. Distribution of sizes of connected components of this graphs
resembles cluster distribution in a lattice percolation near the critical
point.
",2023-12-18,Computer Science - Computation and Language,http://arxiv.org/abs/1007.1025
"Node similarity as a basic principle behind connectivity in complex
  networks","  How are people linked in a highly connected society? Since in many networks a
power-law (scale-free) node-degree distribution can be observed, power-law
might be seen as a universal characteristics of networks. But this study of
communication in the Flickr social online network reveals that power-law
node-degree distributions are restricted to only sparsely connected networks.
More densely connected networks, by contrast, show an increasing divergence
from power-law. This work shows that this observation is consistent with the
classic idea from social sciences that similarity is the driving factor behind
communication in social networks. The strong relation between communication
strength and node similarity could be confirmed by analyzing the Flickr
network. It also is shown that node similarity as a network formation model can
reproduce the characteristics of different network densities and hence can be
used as a model for describing the topological transition from weakly to
strongly connected societies.
",2023-06-22,Physics - Physics and Society,http://arxiv.org/abs/1010.0803
"Software Effort Estimation with Ridge Regression and Evolutionary
  Attribute Selection","  Software cost estimation is one of the prerequisite managerial activities
carried out at the software development initiation stages and also repeated
throughout the whole software life-cycle so that amendments to the total cost
are made. In software cost estimation typically, a selection of project
attributes is employed to produce effort estimations of the expected human
resources to deliver a software product. However, choosing the appropriate
project cost drivers in each case requires a lot of experience and knowledge on
behalf of the project manager which can only be obtained through years of
software engineering practice. A number of studies indicate that popular
methods applied in the literature for software cost estimation, such as linear
regression, are not robust enough and do not yield accurate predictions.
Recently the dual variables Ridge Regression (RR) technique has been used for
effort estimation yielding promising results. In this work we show that results
may be further improved if an AI method is used to automatically select
appropriate project cost drivers (inputs) for the technique. We propose a
hybrid approach combining RR with a Genetic Algorithm, the latter evolving the
subset of attributes for approximating effort more accurately. The proposed
hybrid cost model has been applied on a widely known high-dimensional dataset
of software project samples and the results obtained show that accuracy may be
increased if redundant attributes are eliminated.
",2023-12-21,Computer Science - Software Engineering,http://arxiv.org/abs/1012.5754
"On the effect of the path length and transitivity of small-world
  networks on epidemic dynamics","  We show how one can trace in a systematic way the coarse-grained solutions of
individual-based stochastic epidemic models evolving on heterogeneous complex
networks with respect to their topological characteristics. In particular, we
have developed algorithms that allow the tuning of the transitivity (clustering
coefficient) and the average mean-path length allowing the investigation of the
""pure"" impacts of the two characteristics on the emergent behavior of detailed
epidemic models. The framework could be used to shed more light into the
influence of weak and strong social ties on epidemic spread within small-world
network structures, and ultimately to provide novel systematic computational
modeling and exploration of better contagion control strategies.
",2023-03-24,Computer Science - Social and Information Networks,http://arxiv.org/abs/1102.5420
Well structured program equivalence is highly undecidable,"  We show that strict deterministic propositional dynamic logic with
intersection is highly undecidable, solving a problem in the Stanford
Encyclopedia of Philosophy. In fact we show something quite a bit stronger. We
introduce the construction of program equivalence, which returns the value
$\mathsf{T}$ precisely when two given programs are equivalent on halting
computations. We show that virtually any variant of propositional dynamic logic
has $\Pi_1^1$-hard validity problem if it can express even just the equivalence
of well-structured programs with the empty program \texttt{skip}. We also show,
in these cases, that the set of propositional statements valid over finite
models is not recursively enumerable, so there is not even an axiomatisation
for finitely valid propositions.
",2023-11-08,Computer Science - Logic in Computer Science,http://arxiv.org/abs/1103.1433
"A Discrete Adapted Hierarchical Basis Solver For Radial Basis Function
  Interpolation","  In this paper we develop a discrete Hierarchical Basis (HB) to efficiently
solve the Radial Basis Function (RBF) interpolation problem with variable
polynomial order. The HB forms an orthogonal set and is adapted to the kernel
seed function and the placement of the interpolation nodes. Moreover, this
basis is orthogonal to a set of polynomials up to a given order defined on the
interpolating nodes. We are thus able to decouple the RBF interpolation problem
for any order of the polynomial interpolation and solve it in two steps: (1)
The polynomial orthogonal RBF interpolation problem is efficiently solved in
the transformed HB basis with a GMRES iteration and a diagonal, or block SSOR
preconditioner. (2) The residual is then projected onto an orthonormal
polynomial basis. We apply our approach on several test cases to study its
effectiveness, including an application to the Best Linear Unbiased Estimator
regression problem.
",2023-11-21,Mathematics - Numerical Analysis,http://arxiv.org/abs/1104.2504
Towards joint decoding of binary Tardos fingerprinting codes,"  The class of joint decoder of probabilistic fingerprinting codes is of utmost
importance in theoretical papers to establish the concept of fingerprint
capacity. However, no implementation supporting a large user base is known to
date. This article presents an iterative decoder which is, as far as we are
aware of, the first practical attempt towards joint decoding. The
discriminative feature of the scores benefits on one hand from the
side-information of previously accused users, and on the other hand, from
recently introduced universal linear decoders for compound channels. Neither
the code construction nor the decoder make precise assumptions about the
collusion (size or strategy). The extension to incorporate soft outputs from
the watermarking layer is straightforward. An extensive experimental work
benchmarks the very good performance and offers a clear comparison with
previous state-of-the-art decoders.
",2023-07-26,Computer Science - Information Theory,http://arxiv.org/abs/1104.5616
Characteristics of Optimal Solutions to the Sensor Location Problem,"  In [Bianco, L., Giuseppe C., and P. Reverberi. 2001. ""A network based model
for traffic sensor location with implications on O/D matrix estimates"".
Transportation Science 35(1):50-60.], the authors present the Sensor Location
Problem: that of locating the minimum number of traffic sensors at
intersections of a road network such that the traffic flow on the entire
network can be determined. They offer a necessary and sufficient condition on
the set of monitored nodes in order for the flow everywhere to be determined.
In this paper, we present a counterexample that demonstrates that the condition
is not actually sufficient (though it is still necessary). We present a
stronger necessary condition for flow calculability, and show that it is a
sufficient condition in a large class of graphs in which a particular subgraph
is a tree. Many typical road networks are included in this category, and we
show how our condition can be used to inform traffic sensor placement.
",2023-09-28,Mathematics - Optimization and Control,http://arxiv.org/abs/1106.0349
Model of communities isolation at hierarchical modular networks,"  The model of community isolation was extended to the case when individuals
are randomly placed at nodes of hierarchical modular networks. It was shown
that the average number of blocked nodes (individuals) increases in time as a
power function, with the exponent depending on network parameters. The
distribution of time when the first isolated cluster appears is unimodal,
non-gaussian. The developed analytical approach is in a good agreement with the
simulation data.
",2023-07-19,Physics - Physics and Society,http://arxiv.org/abs/1106.0439
"Another approach to the equivalence of measure-many one-way quantum
  finite automata and its application","  In this paper, we present a much simpler, direct and elegant approach to the
equivalence problem of {\it measure many one-way quantum finite automata}
(MM-1QFAs). The approach is essentially generalized from the work of Carlyle
[J. Math. Anal. Appl. 7 (1963) 167-175]. Namely, we reduce the equivalence
problem of MM-1QFAs to that of two (initial) vectors.
  As an application of the approach, we utilize it to address the equivalence
problem of {\it Enhanced one-way quantum finite automata} (E-1QFAs) introduced
by Nayak [Proceedings of the 40th Annual IEEE Symposium on Foundations of
Computer Science, 1999, pp.~369-376]. We prove that two E-1QFAs $\mathcal{A}_1$
and $\mathcal{A}_2$ over $\Sigma$ are equivalence if and only if they are
$n_1^2+n_2^2-1$-equivalent where $n_1$ and $n_2$ are the numbers of states in
$\mathcal{A}_1$ and $\mathcal{A}_2$, respectively.
",2023-06-19,Computer Science - Computational Complexity,http://arxiv.org/abs/1106.2481
Some results on equivalence of multi-letter quantum finite automata,"  Two quantum finite automata are equivalent if for all input string $\omega$
over the input alphabet the two automata accept $\omega$ with equal
probability. In [Theoret. Comput. Sci. 410 (2009) 3006-3017], it was shown that
a $k_1$-letter QFA $\mathcal{A}_1$ and a $k_2$-letter QFA $\mathcal{A}_2$ over
$\Sigma=\{\sigma\}$, are equivalent if and only if they are
$(n_1+n_2)^4+k-1$-equivalent where $n_i$ is the number of states of
$\mathcal{A}_i$, $i=1,2$, and $k=\max\{k_1,k_2\}$. In this letter, we improve
the above upper-bound to $(n_1^2+n_2^2-1)+k$. This also answers an open problem
of Qiu et al. [Acta Informatica 48 (2011) 271-290]. Further, we show that, in
the case of $\Sigma=\{\sigma_1,...,\sigma_t\}$ with $2\leq t<\infty$, there
exists an integer $z$ such that $\mathcal{A}_1$ and $\mathcal{A}_2$ are
equivalent if and only if they satisfy $z$-equivalent.
",2023-06-06,Computer Science - Computational Complexity,http://arxiv.org/abs/1106.5223
Edit wars in Wikipedia,"  We present a new, efficient method for automatically detecting severe
conflicts `edit wars' in Wikipedia and evaluate this method on six different
language WPs. We discuss how the number of edits, reverts, the length of
discussions, the burstiness of edits and reverts deviate in such pages from
those following the general workflow, and argue that earlier work has
significantly over-estimated the contentiousness of the Wikipedia editing
process.
",2023-01-05,Statistics - Machine Learning,http://arxiv.org/abs/1107.3689
Dynamics in Near-Potential Games,"  Except for special classes of games, there is no systematic framework for
analyzing the dynamical properties of multi-agent strategic interactions.
Potential games are one such special but restrictive class of games that allow
for tractable dynamic analysis. Intuitively, games that are ""close"" to a
potential game should share similar properties. In this paper, we formalize and
develop this idea by quantifying to what extent the dynamic features of
potential games extend to ""near-potential"" games. We study convergence of three
commonly studied classes of adaptive dynamics: discrete-time better/best
response, logit response, and discrete-time fictitious play dynamics. For
better/best response dynamics, we focus on the evolution of the sequence of
pure strategy profiles and show that this sequence converges to a (pure)
approximate equilibrium set, whose size is a function of the ""distance"" from a
close potential game. We then study logit response dynamics and provide a
characterization of the stationary distribution of this update rule in terms of
the distance of the game from a close potential game and the corresponding
potential function. We further show that the stochastically stable strategy
profiles are pure approximate equilibria. Finally, we turn attention to
fictitious play, and establish that the sequence of empirical frequencies of
player actions converges to a neighborhood of (mixed) equilibria of the game,
where the size of the neighborhood increases with distance of the game to a
potential game. Thus, our results suggest that games that are close to a
potential game inherit the dynamical properties of potential games. Since a
close potential game to a given game can be found by solving a convex
optimization problem, our approach also provides a systematic framework for
studying convergence behavior of adaptive learning dynamics in arbitrary finite
strategic form games.
",2023-10-03,Computer Science - Computer Science and Game Theory,http://arxiv.org/abs/1107.4386
